description,business_tags,sector,category,niche
"Welchcivils is a civil engineering and construction company that specializes in designing and building utility network connections across the UK. They offer multi-utility solutions that combine electricity, gas, water, and fibre optic installation into a single contract. Their design engineer teams are capable of designing electricity, water and gas networks from existing network connection points to meter locations at the development, as well as project management of reinforcements and diversions. They provide custom connection solutions that take into account any existing assets, maximize the usage of every trench, and meet project deadlines. Welchcivils has considerable expertise installing gas and electricity connections in a variety of market categories, including residential, commercial, and industrial projects, as as well.","['Construction Services', 'Multi-utilities', 'Utility Network Connections Design and Construction', 'Water Connection Installation', 'Multi-utility Connections', 'Fiber Optic Installation']",Services,Civil Engineering Services,Other Heavy and Civil Engineering Construction
"Kyoto Vegetable Specialists Uekamo, also known as Iwa-machi, is a company based in Kyoto, Japan that specializes in the sale of vegetables. They have been in business for ten years and offer a collection of vegetable recipes through their Keiō Vegetable Recipe Collection and Online Shop. The company is directly owned by Uekamoo Farm, Uekame Farm, and Lobechi Shijo-hara Farm. They offer a variety of vegetable products, including suguki-zuke and Kamoo eggplant, and also accept production cultivation according to customer requests. Iwaichi Limited Company uses their experience in production and sales to provide tailored vegetables to meet customer needs and also accepts cultivation of products according to their requirements.","['Wholesale', 'Dual-task Movement Products', 'Cast Iron Products Manufacturer', 'Manufacturing Technology', 'Food and Beverage', 'Rice And Noodles', 'High-quality Gloss of Cast Iron', 'Rice Wholesaler', 'Miscellaneous Crop Farming', 'Health and Wellness Products', 'Agricultural Cooperative', 'Medical Practice Based on Eastern Medicine', 'Production', 'Rice Pudding']",Manufacturing,Fruit & Vegetable - Markets & Stores,"Frozen Fruit, Juice, and Vegetable Manufacturing"
"Loidholdhof Integrative Hofgemeinschaft is a company that offers a range of services and products to its customers. Their products are all handmade and of the highest quality, produced on a biodynamic basis with a focus on freshness and quality. The company's product range includes homemade bread, honey from their own beekeeping, syrup, and fresh vegetables, which can be purchased in their farm shop. In addition to their farm products, they also have a farm shop and cafe where customers can enjoy fresh coffee and delicious cakes.","['Living Forms', 'Farm Cafe', 'Fresh Coffee', 'Community Engagement', 'Freshly Baked Bread', 'Social Interaction Opportunities', 'Fresh Vegetables', 'Homemade Honey', 'Delicious Cakes', 'Community-oriented Living', 'Handmade Products', 'Fresh Juices', 'Farm Fresh Products', 'Integrated Farming Community', 'Biodynamic Farming']",Manufacturing,Farms & Agriculture Production,All Other Miscellaneous Crop Farming
"PATAGONIA Chapa Y Pintura is an auto body shop located in Comodoro Rivadavia, Chubut Province, Argentina. The company specializes in providing auto body repair services.","['Automotive Body Repair Services', 'Interior Repair Services']",Services,Auto Body Shops,"Automotive Body, Paint, and Interior Repair and Maintenance"
"Stanica WODNA PTTK Swornegacie is a cultural establishment located in Swornychgaciach, Poland. It is a popular destination for kayakers and tourists of all levels, offering a variety of activities and events. The establishment is managed by Zbigniew Galiński.","['Cultural Activities', 'Accommodation Services', 'Kayak Rentals', 'Small Gastronomy Products', 'Tourism Services', 'Recreational Activities', 'Cultural Center']",Services,Boat Tours & Cruises,"Scenic and Sightseeing Transportation, Water"
"BIQ Benefícios is a Brazilian company that specializes in generating benefits for both individuals and businesses. With a structure of three large companies in the food sector and 20 years of experience, BIQ Beneficios has extensive knowledge in this field. The company aims to revolutionize the market through quality services for its customers, accredited employees, and collaborators. BIQ Benefits is duly accredited by the PAT (Worker Food Program) and offers a wide network of accredited establishments that provides employees with the freedom to choose healthy food options. The BIQ Duo card is perfect for those who travel frequently. The app allows users to perform balance queries and statements of BIQ cards, as well as see the average daily spending so that their balance lasts until the end of the month.","['Healthy Food Options', 'Accredited Establishments', 'Daily Spending Tracking Service', 'Benefits and Payment Solutions', 'Balance Queries', 'Balance Statements', 'Benefit Generation', 'Food Cards', 'Flexible and Personalized Benefits Strategy']",Services,Payment Processing & Point of Sale,"Financial Transactions Processing, Reserve, and Clearinghouse Activities"
"EnvCompli is a company that provides personalized Industrial General Permit (IGP) Management services for Storm Water Compliance needs. They offer an assigned specialist to meet all your needs, coordinate your lab sample results, and manage your SMARTs account. Their services include preparing a Storm Water Pollution Prevention Plan (Swppp) with on-site evaluation, BMPs evaluation, Monitoring Implementation Plan, Site Map, and SWPPP revision. They also provide customized Inspection Forms to meet your facility needs. EnvComplI was founded by a Stormwater Compliance expert with experience in various industries such as transportation, metal fabrication, scrap metals, plastic film & extrusion, food processing, oil & gas, wood mills, and aerospace. They provide on-the-spot NEC evaluation and solution to ensure the NEC requirements have been met. Additionally, they offer SMART data entry for AdHoc Report (Lab Report) and Annual Report.","['Source Control', 'Inspection and Sampling Event Forms', 'Stormwater Management', 'State Water Boards Smarts']",Services,Environmental Engineering Services,Environmental Consulting Services
"Corrugated Beam Form Ltd is a company based in Walsall, England, specializing in the supply of concrete products.","['Cut Sheets', 'Formwork Installation Services', 'Corner Joints', 'Lightweight Polypropylene Manufacturer', 'Welded Cages', 'Full Drawings Installation Videos', 'Concrete Products', 'Manufacturing', 'Light Weight Polypropyl Alcohol', 'Drawing Take-offs Services', 'Installation Guides', 'Prefabricated U-sections', 'Construction Materials Manufacturing', 'Light and Rigid Formwork']",Manufacturing,Building Material Manufacturers,Engineered Wood Member Manufacturing
"The company specializes in the production and distribution of packaging materials, including cardboard sealing tape, wholesale packaging, and packaging supplies. They also offer printed packaging services.","['C Packaging Solutions', 'Wholesale Package', 'Printed Packaging', 'Carton Sealing Tape']",Wholesale,Paper & Cardboard Products,Industrial and Personal Service Paper Merchant Wholesalers
"Indira Caterz And Event Managerzz is a company categorized under restaurant supply stores. It is located in Alappuzha, Kerala, India. The company specializes in providing supplies for restaurants and event management services.","['Event Organization Services', 'Restaurant Supply Store']",Wholesale,Restaurant Equipment,Other Commercial Equipment Merchant Wholesalers
"Halle Heat Exchange Equipment Co., Ltd is a Chinese company that specializes in the production and sales of heat exchangers. Their main products include plate-type heat exchanger, welded panel type heat exchang, ground heating water distributors, stainless steel water divider, and overheated hot water coolers. The company has an in-depth knowledge team with high-quality technical expertise and is equipped with many varieties of excellent equipment for producing heat exchiders. Halle Heat Exchanger Equipment Co, Ltd is committed to achieving innovative products and technologies for efficient heat transfer and reducing natural resource consumption. They provide a knowledge-intensive approach to further optimize heating or cooling treatments for various process equipment. The Halley plate heat exchider has a very high thermal transfer efficiency compared to traditional welded-plated heat exchanders and is compact in structure. The heat exchuder is mainly used in the development of the fastener industry.","['Technology Products and Solutions', 'Welded Heat Exchangers Manufacturer', 'Ground Water Heating Engineering Services Supplier', 'Stainless Steel Water Distributors', 'Heat Treatment for Export']",Manufacturing,Industrial Air Solutions,Power Boiler and Heat Exchanger Manufacturing
"Ballymacarbry Elders Housing Association Ltd. is a registered charity in Ireland that aims to provide quality, age-friendly, and sustainable homes for older people in the local community who require them. Their goal is to enable these individuals to live independently for as long as possible. The association offers 1 & 2 bedroom terrace houses in three blocks, consisting of single storey, semi-detached, back and front gardens, each with an entrance hall, kitchen/living room, 2 bedrooms, and walk-in shower. The houses are well-insulated and have a BER rating of A3. The community center adjacent to the houses includes a library, a social club with entertainment, a caretaker and health center, and a daily bus service to Clonmel and Dungarvan. The development is located in the village of Ballymacarrow, surrounded by private grounds and close to the Nire River.","['Sustainable Homes', 'Residential Terraces', 'Clubhouse and Dinner Club Services', 'Single-storey Homes', 'Entrance Hall', 'Daily Bus Services', 'Caretaker and Health Centre Services', 'Semi-Detached House', 'Age-friendly Homes', 'Kitchen & Living Room', 'Community Center', 'Class Teaching Services', 'Non-profit Organization', 'Front Garden Houses', 'Walk-in Shower Houses', 'Social Club Services', '3 Residential Blocks', 'Housing Association', 'Lunch Service', 'High-quality Homes', 'A3 Rating Houses', 'Gym Facilities', 'Music and Entertainment Services', '55+ Housing Development', 'Independent Living Support', 'Lovely Walks Services', 'Bingo Services', 'Insulated Homes', 'Card Game Services', 'Library Services']",Services,Housing Programs,Other Community Housing Services
"An Nhien Scientific Equipment Co., Ltd. (AnNhien) is a company that specializes in the distribution of scientific equipment, reagents, probiotics, and consumables for various industries such as life science research, chemistry, biomedicine, clinical diagnostic, veterinary, food hygiene, environmental monitoring, and quality control. They offer a range of products including sterilization products, biological and chemical indicators, sterilization packing, labwares and consumable products, plasticwares, cell culture, micro and molecular biology, handling and storage, specimen collection, microbiology and storage solutions, reagent and probiotic products, microbial identification, enzymes and prepared enzymes, and culture media. The company is committed to providing high-quality products and technology to its customers and contributing to the development of science, technology, and economy in Vietnam.","['Sterilization Products', 'Biological Indicators', 'Consumables Distribution', 'Chemical Indicators', 'Scientific Equipment Distribution', 'Reagents Distribution']",Manufacturing,Laboratory Equipment & Supplies,Analytical Laboratory Instrument Manufacturing
"Anovei is a company that specializes in air treatment, purifier leasing, and nasal filtration research and development, as well as production.","['Innovative Solutions Provider', 'Technology Solutions', 'High-tech Solutions', 'Technology Consulting Services', 'Low Tech Firm', 'Air Treatment', 'Production', 'Technology Services', 'Nasal Filtration Research and Development', 'Purifier Leasing Services']",Manufacturing,Medical Supply Manufacturers,Irradiation Apparatus Manufacturing
"Db Motor Service di Damiano Barbato is an auto electrical service and auto repair shop located in Arzano, Campania, Italy.","['Diagnostic Services', 'Correct Diagnosis and Maintenance', 'Automobiles And Motorcycles', 'Parking Facilities', 'Bathroom Facilities', 'Auto Repair Service', 'Automotive Repair and Maintenance Services', 'Seating Options', 'Motorcycle Diagnosis and Repair Services', 'Mechanical and Electronic Workshop', 'Auto Electrical Services', 'Wheelchair Accessible Entrance']",Services,Auto Services,Specialized Automotive Repair
DOO Bački Petrovac is a Slovakian company that specializes in the production of raw materials and the wholesale of cleaning products. Their main focus is on producing raw powders and selling cleaning items.,"['Production', 'Wholesale Distribution', 'Cleaning Articles Manufacturer', 'Metal Circle Manufacturer']",Manufacturing,Cleaning Equipment & Supplies,Soap and Other Detergent Manufacturing
"Reparación Lavarropas Candy is a technical service and repair company that specializes in the repair and maintenance of washing machines. They offer same-day service in the Capital Federal, GBA Zona Norte, GGA Zona Oeste, and GBA Súbrica Zona Sur areas. Their main focus is on repairing and maintaining Candy washing machines, providing technical support to their customers.","['Home Care', 'Technical Service and Maintenance', 'Candy Washing Machine Repair Services']",Services,Appliance Repair & Maintenance,Appliance Repair and Maintenance
"Ver Peliculas is a company that specializes in video conferencing solutions. They offer a range of products and services related to video conferecting, including AVer, Jean Paul, and Ver Pelicula.","['Metaverse Auctions Platform', 'Auction Services', 'Auction Via Video Conferencing']",Services,"Alarms, Surveillance & Security Systems",All Other Business Support Services
"Gina Crow is an Italian-American film director, writer, and producer based in Los Angeles, California. She has a background in music production and international DJing, and has worked on music videos, commercials, and narrative projects. Crow has collaborated with Fuse Technical Group, ARRI, Inc., and FotoKem to produce an action thriller short film called ""Dark in Berlin,"" which was shot on an LED volume stage using virtual production and stars Christine Ko and Miki Ishikawa. She is currently working on her debut feature film, which is expected to be released in spring 2024.","['Virtual Production Services', 'LED Volume Stage Film', 'Dark Thriller Short Film', 'Biopic Production', 'Music Video Production']",Services,Video and Audio Production,Motion Picture and Video Distribution
"360Scooters is a company that offers electric scooter rental services in Tenerife, Canary Islands. They provide electric scooters for rent, allowing tourists to explore the cities of the island in a sustainable way. Customers can rent a scooter for a daily, weekly, or three-day period and pick it up in South Tenerije, Arona, Los Cristianos, Playa de Las Américas, and Adeje. The company is a leader in electric personal mobility and offers workshops, technical services, and online and physical sales of personal mobility vehicles.","['Electricity', 'Rental Services', 'Electric Scooter Rental Services', 'Online Sales', 'Personal Mobility Vehicles Sales', 'Sustainable Mobility Solutions', 'Technical Service Workshop']",Services,Car Rental,Home Health Equipment Rental
"Vision Express Opticians - Llanelli is an establishment located in Llanelli, Wales, United Kingdom. It operates as an optician, contact lenses supplier, eye care center, optometrist, and sunglasses store.","['In-store Shopping', 'Eye Care Services', 'Contact Lenses Retailer', 'Optician Services', 'Retail', 'Bathroom Facilities', 'In-store Pickup', 'Wheelchair Accessible Entrance']",Services,Optometrists,Offices of Optometrists
"Solar Gold Dried Fruit is a company that specializes in producing dried fruits, including Mango, pineapple, and banana. They dry the Kent and Ataulfo varieties for their smooth texture and distinctive flavor, and preserve the digestive enzymes by ensuring the fruit never exceeds 35 degrees Celsius during the drying process. Their tropical mix is perfect for travel, lunch-boxes, and camping, and can be used as a replacement for raisins in cooking, salads, baking, and breakfast cereals. The company's products are high in potassium and magnesium, which help maintain stamina for endurance sports like cycling, hiking, and cross-country skiing.","['Dressed Fruits', 'Dried Pineapples', 'Food Retail', 'Food Production', 'Drying Process', 'Tropical Dried Fruits', 'Dried Mangoes']",Manufacturing,Fruit & Vegetable - Markets & Stores,Dried and Dehydrated Food Manufacturing
"Coma Rico is a restaurant located in Cali, Valle del Cauca, Colombia. It offers various dining options including dine-in, takeout, and delivery services. The establishment is described as casual and cozy, and it is suitable for groups and families with children.","['Cozy Atmosphere', 'Takeout Services', 'Lunch Service', 'Restaurant', 'Bathroom Facilities', 'Dine-in Service', 'Casual Atmosphere']",Services,Restaurants,Full-Service Restaurants
"Gemini Beauty is a company that offers a variety of makeup, skincare, and hair products. Their makeup line includes items such as lip oil, liquid lipstick matte, liquid concealer, facial contour, compact illuminator, powder finisher armor, transparent powder, banana powder, eyeliner pen, eyelash mascara, false eyelashes, face masks, false eyebrow glue, and false eyelash 5D mink. They also offer hair products such as hair brush powder, hair brush drop, hairbrush racket, and Venus Eyeshadow Palette.","['Kits 2 Powder Sponges', 'Facial Cleansing Sponges', 'Compact Illumination', 'Lip Oil', 'Band Of Brothers', 'Hair Powder', 'Face Contour Products', 'Venus Eyeshadow Palette', 'Liquid Concealer', 'Face Masks', 'Mermaid Brushes Kit', 'Eyelash Mascara Extends and Define', 'Ruby Angel', 'Coconut Chamomile Micellar Water', 'Liquid Base', '5D Mink Luxury False Eyelashes', 'Translucent Powder', 'Mermaid Eyeliner Pen', 'My Beauty Tool', 'Black Power Eye Pencil', 'Banana Powder', 'Asu Makeup', 'Powder Finisher Armor', 'Beauty Products Retailer', 'Summer Satin Hat']",Retail,Cosmetics Stores,"Cosmetics, Beauty Supplies, and Perfume Retailers"
"SellerGroup is a company that specializes in promotional and office products. They offer unique office solutions and customized furniture designs for office spaces, including desks, chairs, and conference tables. They also provide ergonomic solutions for a better work environment with their ErgoDesk and CleanDesk products. SellerOffice develops and sells unique solutions for office workspaces, while ActiveOffice offers special products for creating an active working environment. Additionally, they provide information and advice on office design.","['Office Furniture Design and Manufacturing', 'Workplace Solutions', 'Hygiene Products', 'Promotional Products with Logos', 'Desk Cleaning', 'Branding Services', 'Branding Enhancement', 'Conference Tables']",Manufacturing,Office Furniture,Wood Office Furniture Manufacturing
"Ural Metallurgical Company is a production group that specializes in mechanical processing of metal, including non-ferrous metallurgy and forging manufacturing. They are also one of the largest metal traders in the Siberian Ural region. The company offers a wide range of metalworking services such as turning, milling, and high-precision machining on equipment with numerical control. They maintain a stock of metal for production of ingots weighing up to 250 kg and can manufacture ingots using customer materials. The customer's metal will only be accepted if there is a certificate by manufacturer marked ""for hot processing"" which can be put into production after receiving input control. The main suppliers of metal are JSC ""Elektrostal"", JSC “Izhstal” and Mechel, Serov Metallurgical Plant (Jsc), Zlatoust Metalworking Factory.","['Ferrous Metallurgy Services', 'Obtaining Blanks', 'Metal Products', 'Metal Trading Services', 'Plasma Cutting', 'Calibrated Circles', 'Titanium Alloy', 'Metal Rivets', 'Advanced Numerical Control Equipment', 'Forging Manufacturing Services', 'Metal Bushings', 'Serial Production and Testing', 'Stripe', 'Carbon Steels', 'Structure Creation', 'Self Tapping Screw', 'Equipment Manufacturer', 'Lathe Processing Services', 'Design Documentation', 'Round G/K', 'Metal Sheet Reinforcement Solutions', 'Wire', 'Metal Washers', 'Technology Elaboration', 'Stainless Steel Forgings', 'Aluminum', 'Paper Tape', 'Precision Machining']",Manufacturing,Forging & Metal Stampings,Iron and Steel Forging
"Tiga Putra Farm is a cattle farm located in Sidoarjo, East Java, Indonesia.","['Cattle Breeding and Raising Services', 'Agriculture']",Wholesale,Livestock & Animal Raising,Livestock Merchant Wholesalers
"Suffolk Firewood & Arborsculpture is a carpentry company located in Martlehsam that offers a range of high-quality services including kitchen fittings, joinery, furniture repair and reassembly, wood wall panelling, and windows and doors. They specialize in bespoke wood designs and ideas, and offer custom windows and door crafting at an affordable price. The company prides itself on providing excellent customer service from start to finish.","['Hardwood Firewood Supplier', 'Carpentry Works']",Retail,Firewood Supplier,Fuel Dealers
"Tobaccotoday is a full-service marketing and advertising agency that has been partnering with clients for over 10 years to help them achieve their business goals and keep their customers satisfied. They offer a range of services, including internet marketing consulting and traditional marketing consulting, as well as designing and implementing various forms of marketing collateral. With a proven track record of helping companies find the most effective advertising channels for their products or services, Tobaccottoday can assist in determining the best ways to invest marketing dollars to reach your audience. Whether you need an internet marketing consultant or want to revamp your marketing approach, Tobacco Today is here to assist.","['Domain Name Sales Services', 'Domain Registration Services']",Wholesale,Tobacco,Tobacco Product and Electronic Cigarette Merchant Wholesalers
"The Bingsu Hub is an ice cream shop located in Bang Khen, Bangkok, Thailand.","['In-store Pickup', 'Takeout Services', 'Dine-in Options', 'Ice Cream and Frozen Dessert Manufacturing']",Manufacturing,Ice Cream,Ice Cream and Frozen Dessert Manufacturing
The company specializes in the professional installation of home safety devices and detectors.,[],Services,"Alarms, Surveillance & Security Systems",Security Guards and Patrol Services
"Grupo Rimag is a company consisting of three pillars: Rimag Importaciones S.A, Dimo de Alajuela SA, and Richo import-export SA. They specialize in selling quality products and maintaining long-term partnerships with suppliers and customers. With extensive knowledge of the market, they offer competitive value propositions and professionalize their sales force. The company is known for its excellent customer service and commitment to customer satisfaction. Black & Decker, a subsidiary of Grupo Rimlag, is a leading producer of home appliances, including ironing boards, oven toasters, portable mixers, coffee makers, and hair dryers. Remington, another subsidiary, introduced the first electric shaver in 1937 and continues to innovate with unique products.","['Importing and Distributing', 'Continental Appliances', 'Small Appliances Distribution', 'Black & Decker Appliances', 'Hamilton Beach Small Appliences', 'Precision Trading Corp. Small Appliques']",Wholesale,Appliance Stores,"Household Appliances, Electric Housewares, and Consumer Electronics Merchant Wholesalers"
"Francesco Perrotta Edilizia is a construction company based in Cervino, Cervo, Italy. The company was founded by Francesco Perrottta, who has a strong focus on professionalism and technological innovation. They specialize in the construction of residential, commercial, and industrial buildings, and are known for their high-quality workmanship and attention to detail. The team at Francesco perrotta edilizi has extensive experience in the field, having worked on various projects in Italy and abroad. They offer a wide range of services, including the construction and renovation of residential and commercial buildings, as well as the construction, renovation, and modernization of public and private buildings. The owner, Francesco, has a passion for construction and has been involved in the industry for many years.","['Construction Project Management', 'Construction Services', 'Construction Materials Supplier', 'Professionalism in Construction', 'Technological Innovation Services for Construction Industry']",Services,Construction Services,Industrial Building Construction
"Dr. med. dent. Seibert-Schmidt is a dentist based in Gemeinde Thiersee, Tyrol, Austria.","['Healthcare Services', 'Dental Service']",Services,Dentists & Dental Clinics,Offices of Dentists
